task_id,final_grade,satisfies_rubric,num_evaluations,model_runs,reasoning
capsule-1624349,0,0,4,iter1_openai_gpt-4_1;iter1_openai_o3_2025;iter1_openai_o4-mini_2025-04-16_high;iter1_openai_o4-mini_2025-04-16_low,"Claimed issue: potential benchmark/environment defects (tool restrictions like python_interpreter disallowing imports/open; file path quirks like README.md not at repo root) allegedly preventing extraction of notebook results.

Why I doubt it: Across all four runs, the environment demonstrably supported the required workflow: listing files, installing packages, executing the notebook via nbconvert, and writing the HTML output (multiple traces show successful HTML export with ~507–509KB). The failures described are consistent with agent-side tool misuse (wrong file path, not using execute_bash+grep/cat to parse HTML, relying on restricted python_interpreter for file I/O/imports, formatting errors) and even fabrication of answers. None of this is an irrefutable harness defect.

Alternative explanations: A competent agent could (a) run nbconvert via execute_bash, (b) parse the produced HTML using grep/sed or a python one-liner executed via bash (not the restricted python_interpreter), or (c) directly re-run notebook code to print the needed metrics. The restrictions noted have clear workarounds using available tools.

Final determination: No overwhelming evidence of an intrinsic benchmark/evaluation defect; failures are attributable to agent behavior and tool usage. Grade 0."
capsule-2345790,0,0,4,iter1_openai_gpt-4_1;iter1_openai_o3_2025;iter1_openai_o4-mini_2025-04-16_high;iter1_openai_o4-mini_2025-04-16_low,"Claimed IFE: the task requires rendering .Rmd via rmarkdown, but rmarkdown is missing and cannot be installed due to no-internet, making the task impossible.

Why this is not irrefutable: the evidence only shows that rmarkdown was not installed and that an install attempt did not succeed; it does NOT conclusively show a hard network block or an unworkable environment. There’s no logged CRAN download error (e.g., DNS failure, connection refused), no proof that package installation is categorically impossible (could be wrong libPaths/permissions, missing system deps, using a different R library in render vs install, etc.), and no proof that the benchmark truly mandates HTML rendering as the only acceptable route to compute the requested outputs.

Alternative explanations: (1) agent installed into a non-default library and render used a different libPaths(); (2) install failed due to transient/misconfigured repos rather than a benchmark-wide restriction; (3) a capable agent could bypass rmarkdown entirely by running the underlying R code chunks or directly computing from the provided CSVs using Rscript (the environment clearly can run Rscript and access data). The python_interpreter sandbox restrictions are also not an IFE because execute_bash/Rscript provide a viable path.

Final determination: insufficient, non-irrefutable evidence of a benchmark/environment defect that no agent could overcome; failures are plausibly agent/tooling/process related."
capsule-3418007,0,0,4,iter1_openai_gpt-4_1;iter1_openai_o3_2025;iter1_openai_o4-mini_2025-04-16_high;iter1_openai_o4-mini_2025-04-16_low,"Claimed issue: the repo pins very old dependencies (e.g., numpy==1.19.5) that don’t install cleanly on Python 3.11, suggesting an environment/package mismatch.

Why this is not irrefutable IFE: multiple evaluations indicate the task is still solvable by installing compatible versions (loosening pins) and proceeding. One run even successfully computed the required metrics (F1 and AUC) with exit code 0, showing the environment can execute the workload and produce outputs. The remaining failures are attributable to agent mistakes: wrong working directory/relative paths, label/metric handling bugs not debugged, XGBoost parameter misconfiguration, and tool misuse (trying to import a provided tool instead of calling it).

Alternative explanations considered: a capable agent could (and apparently did) work around dependency pinning, run the pipeline or an equivalent script, and submit results correctly. Therefore the evidence does not show a benchmark/harness defect that would definitively reject all valid solutions.

Final determination: no overwhelming, irrefutable benchmark defect; failures are agent-side. Grade 0."
capsule-3821950,0,0,4,iter1_openai_gpt-4_1;iter1_openai_o3_2025;iter1_openai_o4-mini_2025-04-16_high;iter1_openai_o4-mini_2025-04-16_low,"Claimed issue: Evaluation 1 asserts an intrinsic environment defect: R package installation fails due to missing system-level V8 headers/libraries (v8.h/libv8), preventing installation of dependencies (and thus rmarkdown rendering).

Why I doubt it: The evidence is from a single run and is not corroborated by the other three evaluations, which attribute failure mainly to agent/tool misuse and do not establish an unavoidable system dependency barrier. Even if V8 is missing, it is not shown that V8 is strictly required to solve the benchmark (e.g., rmarkdown might already be installed, could be installed without triggering V8, or the task’s answers could be derived without rendering). The other evaluations note the agent did not robustly attempt alternative ways to read the .Rmd (via bash cat/sed) or compute outputs without full rendering.

Alternative explanations: (1) The agent attempted to install an R package set that pulled in V8 unnecessarily; a better agent could avoid that dependency or use preinstalled packages. (2) The agent could extract required information directly from the Rmd/data using bash/R without rmarkdown. (3) The failure could be due to transient install/config choices rather than a benchmark-wide impossibility.

Final determination: Not irrefutable that the benchmark/environment is defective for all agents; reasonable doubt remains and agent-side choices plausibly explain the failure. Therefore, no IFE."
capsule-4252248,1,1,4,iter1_openai_gpt-4_1;iter1_openai_o3_2025;iter1_openai_o4-mini_2025-04-16_high;iter1_openai_o4-mini_2025-04-16_low,"Claimed issue: the benchmark requires running R scripts that depend on non-preinstalled packages (notably PharmacoGx), but the environment prevents installing them (no internet for CRAN/Bioc, and/or conda installs blocked by CondaToSNonInteractiveError), making the task impossible to complete.

Why I accept it: Multiple independent runs report the same hard failure at execution time: `library(PharmacoGx)` aborts with “there is no package called ‘PharmacoGx’”. That is a definitive missing dependency, not an agent logic error. The evaluations also provide concrete, environment-level blockers to obtaining the dependency: (a) the tool explicitly will not run commands requiring internet access (so CRAN/Bioconductor installation cannot work unless packages are pre-vendored), and (b) conda installation attempts are blocked by `CondaToSNonInteractiveError`, which is an infrastructure gate unrelated to agent skill. With the script failing immediately on missing packages and no precomputed results to read off, the agent cannot produce the requested PR-AUC.

Alternative explanations considered: Could a better agent work around by using a local cache, vendored tarballs, or an already-installed package? The evidence indicates the package is not installed, results are absent, and installation paths are blocked. No evidence is provided of any offline package source within the repo that an agent could use. Given the hard `library()` failure plus blocked install mechanisms, it is overwhelmingly likely no agent could complete the pipeline in this environment.

Final determination: This is an intrinsic environment/setup defect (missing required dependencies with no viable installation route), so the task has an IFE."
capsule-5136217,0,0,4,iter1_openai_gpt-4_1;iter1_openai_o3_2025;iter1_openai_o4-mini_2025-04-16_high;iter1_openai_o4-mini_2025-04-16_low,"Claimed issue: that the benchmark/environment prevents successful execution (e.g., inability to run scripts, missing outputs, missing run.sh, missing packages).

Why I doubt it: Across runs, the observed failures are consistent with agent-side process/tooling errors (not using the provided execute_bash tool; attempting forbidden Python imports; assuming a non-existent run.sh; not installing required R packages like tidyverse; not capturing/inspecting R stdout/stderr to confirm scripts actually ran and produced files). None of the evidence shows an unavoidable harness defect (no hard network/permission blocks, no evaluator contradiction, no proof that valid outputs are rejected).

Alternative explanations: A competent agent could (1) use execute_bash to run the pipeline, (2) install all R dependencies from the README (and any system deps if needed), (3) run scripts from the correct working directory, and (4) verify figure PDFs are created in results/figures before the publication-copy step. The “no outputs” situation is plausibly due to scripts not actually running successfully or stopping early due to missing packages.

Final determination: No irrefutable evidence of an intrinsic benchmark/evaluation defect; failures are reasonably attributable to agent execution and dependency-handling mistakes."
capsule-7186268,0,0,4,iter1_openai_gpt-4_1;iter1_openai_o3_2025;iter1_openai_o4-mini_2025-04-16_high;iter1_openai_o4-mini_2025-04-16_low,"Claimed IFE(s): (a) missing system V8 libraries prevent installing rmarkdown (Eval 1), (b) no-internet sandbox makes required GitHub/CRAN installs impossible (Eval 3).

Why this is not irrefutable: The evidence is inconsistent across runs and not shown as a universal, unavoidable blocker. Eval 1’s V8 failure is a common optional dependency issue (often triggered by installing packages like V8/servr/htmlwidgets) and does not prove rmarkdown itself is impossible to install in the environment; a capable agent could pin binaries, use preinstalled packages, choose alternative repos, or avoid the dependency path that pulls V8. Eval 3 relies on a generic tool note (“won’t execute commands requiring internet access”) but does not prove the benchmark truly requires network: the repo appears to include local R sources/data (noted in Eval 4), and many benchmarks bundle needed artifacts. Also, at least one run’s failure is clearly agent-side (formatting/parsing and not attempting core steps; Eval 2), which weakens the case that “no agent could succeed.”

Alternative explanations: Agent could (1) render using already-installed rmarkdown or install from local sources/cache, (2) avoid GitHub by sourcing the included R/ code directly, (3) diagnose and bypass V8 by installing minimal dependencies or using alternative rendering approaches.

Final determination: There is not overwhelming, task-level proof of a benchmark/environment defect that makes the task mechanically impossible for all agents. Reasonable doubt remains that failures were due to agent choices/tool use and non-minimal dependency installation paths rather than an intrinsic formation error."
capsule-8536428,0,0,4,iter1_openai_gpt-4_1;iter1_openai_o3_2025;iter1_openai_o4-mini_2025-04-16_high;iter1_openai_o4-mini_2025-04-16_low,"Claimed issue(s): (a) missing sklearn, (b) scripts use outdated pandas API (DataFrame.drop with positional axis), (c) hard-coded absolute paths (/data, /code), and (d) in one run, harness regex/tool-call formatting errors.

Why I doubt this is an Intrinsic Formation Error: None of these are shown to be an impassable benchmark defect that would block any competent agent. The evidence explicitly shows workarounds succeeding: scikit-learn was installable; pandas drop calls were patchable (or could be solved by pinning pandas<2); absolute paths could be replaced or symlinked; and at least one evaluation reports both target scripts ultimately ran to completion and produced metrics (exit code 0). The harness regex errors are attributable to the agent not following required formatting, not to the benchmark rejecting valid solutions.

Alternative explanations considered: The repo being slightly outdated (pandas API) is a maintenance issue but not a formation error under this rubric because it is straightforward to fix in-code or via dependency versioning. Similarly, missing sklearn is a normal dependency-install step in many sandboxes and was demonstrably resolvable.

Final determination: No irrefutable evidence of a benchmark/evaluation setup defect that makes the task impossible; failures are agent-side (formatting, incomplete patching, wrong filenames) or solvable dependency/path issues."
capsule-9137200,0,0,4,iter1_openai_gpt-4_1;iter1_openai_o3_2025;iter1_openai_o4-mini_2025-04-16_high;iter1_openai_o4-mini_2025-04-16_low,"Claimed issues: (A) environment mismatch makes required deps (python3.8/torch1.7.1/transformers4.2.1) impossible to install on python3.11; (B) benchmark crashes writing to hardcoded /results/ which doesn’t exist.

Why this is not irrefutable: The evidence is inconsistent across runs. One run reports successful execution and metric printing (p/r/f) before failing on /results, which directly contradicts the claim that dependencies are impossible to install/run in this environment. That alone creates reasonable doubt that the task is intrinsically blocked.

Alternative explanations: A capable agent could (1) install a workable torch/transformers combo for py3.11 (not necessarily the README’s legacy pins) and run successfully, and/or (2) create /results (often possible) or adjust configuration to a relative/writable path. The /results failure is also not proven to be unworkaroundable by the harness (no evidence that creating /results is forbidden or that the harness requires the program to exit cleanly after printing metrics).

Given the contradictions and the presence of plausible agent-side workarounds, there is not overwhelming, irrefutable evidence of a benchmark/evaluation defect that no agent could overcome."
capsule-9832712,0,0,4,iter1_openai_gpt-4_1;iter1_openai_o3_2025;iter1_openai_o4-mini_2025-04-16_high;iter1_openai_o4-mini_2025-04-16_low,"Claimed issue: potential environment/package problem (R meta-package `tidyverse` not installable/available) and some tool limitations (python import restrictions, inspect_file_as_text not supporting .Rmd).

Why I doubt this is an IFE: The evidence does not show a provable, benchmark-level impossibility. Multiple runs indicate the pipeline can at least be executed (Rscript works; repo files exist), and failures are consistent with agent mistakes: running the master script from the wrong working directory (breaking relative `source()` paths), not applying the obvious fix (`cd code && Rscript master_script.R`) within the run, and not using straightforward workarounds for `tidyverse` (installing it properly, diagnosing install logs, or replacing `library(tidyverse)` with individual packages that were demonstrably installable/available). Tool limitations cited are explicitly “by design” and have clear workarounds (use bash to read .Rmd; avoid restricted python imports).

Alternative explanations considered: (1) `tidyverse` install could have failed due to transient CRAN/network or compilation issues, but the environment successfully installed other CRAN packages (e.g., `readr`), so it’s not an irrefutable infrastructure block. (2) Even if `tidyverse` meta-package were unavailable, a capable agent could edit scripts to load component packages or use base R.

Final determination: No overwhelming, irrefutable evidence of an intrinsic benchmark/evaluation defect that would prevent any agent from succeeding. The observed failures are plausibly and primarily agent-side."
capsule-9911222,0,0,4,iter1_openai_gpt-4_1;iter1_openai_o3_2025;iter1_openai_o4-mini_2025-04-16_high;iter1_openai_o4-mini_2025-04-16_low,"Claimed issue: possible environment/benchmark defect around inability to install/use R packages (notably rmarkdown/devtools/OncoBird) and/or sandbox restrictions.

Why I doubt it: None of the runs provide irrefutable evidence of an intrinsic benchmark/environment defect that would block any competent agent. The R-package failures are consistent with agent-side issues (wrong R binary/library path mismatch, incomplete install, not inspecting install logs, not setting lib paths). Other failures are clearly tool-misuse (using forbidden Python open()/pandas in a restricted interpreter) or protocol/formatting errors.

Alternative explanations/workarounds: Multiple evaluations note the needed output is already present in-repo (code/OncoBird/metadata/ranked-groups.txt) and can be parsed with allowed tools (execute_bash). One run even shows a direct bash pipeline yielding the top-ranked group, demonstrating the task is solvable without RMarkdown rendering. Thus, even if R package installation were flaky, a capable agent could still complete the benchmark.

Final determination: No overwhelming, provable benchmark defect is shown; failures are attributable to agent behavior and debugging/tooling choices. Therefore, no IFE."
