task_id,criteria,grade,correct,explanation,model_run
37,scicode,1.00,0,"existence_reasoning: The benchmark environment/tooling is internally inconsistent. The agent is instructed to call tools like regular python functions, but the trace shows tool calls being routed through python_interpreter with code that calls web_search, which is not available inside python_interpreter. Additionally, numpy's context manager np.errstate appears broken in this environment (raising a NoneType __exit__ error), which is not expected behavior in a normal numpy installation and indicates an environment/harness defect. These are structural issues that can impede any agent attempting to follow the prescribed workflow (search + test in interpreter) and can cause failures unrelated to solution correctness. | causation_reasoning: The run is marked failed, and the agent encountered an environment-level exception during the required testing step: AttributeError: 'NoneType' object has no attribute '__exit__' when using np.errstate. This is not an agent logic error; it indicates the harness/environment returned an invalid context manager. Since the rubric requires agents to test via the python interpreter, this defect directly blocks successful completion of the mandated process and plausibly leads to the run being considered failed. The earlier web_search misuse (being executed inside python_interpreter) also reflects tool routing problems, but the decisive failure shown is the broken context manager error during unit testing. | evidence: 1) Tool routing issue: the agent attempts web_search but the call is executed via python_interpreter: ""Calling tools: [{'name': 'python_interpreter', 'arguments': 'search_result = web_search(...'}]"".
2) Environment defect causing crash: ""Error: Code execution failed ... due to: AttributeError: 'NoneType' object has no attribute '__exit__'"" (triggered when the agent used ""with np.errstate(...):"").
3) The workflow required testing: ""Then test that function using the python interpreter"" and the crash occurs exactly at this step.",scicode_scicode_tool_calling_agent_claudeopus41_1755801688_UPLOAD
42,scicode,1.00,0,"existence_reasoning: The benchmark-provided starter code for `gain()` is malformed/contradictory and includes invalid Python constructs, which can mislead or break downstream steps that rely on it. The prompt says the evaluator provides working prior-step code, but instead it supplies a `gain()` implementation with impossible lines like `((R1 * R2) ** -1).ln()` and multiple overwrites of `alpha_mirror` (including incorrect non-log variants). This is an intrinsic scaffolding error: a correct agent cannot both ""use the functions gain(...) and current_density(...) given"" and also have those given functions be syntactically/semantically broken. Additionally, instructions conflict about imports: dependencies say only `numpy` and ""do not include at beginning"", yet the provided `gain()` uses `math` and the system later forces removal of imports, creating further misalignment. | causation_reasoning: The agent's failure is directly tied to the flawed scaffold: after a system ""cleanup"" step, the agent output for `gain()` was corrupted (multiple nonsensical redefinitions and illegal `.ln()` usage), and later the final `threshold_current` they returned deviated from the correct physics because they followed/echoed the bad provided scaffold (using `alpha_mirror = (1/(2L))*(1/(R1*R2))**0.5` instead of the required logarithmic mirror loss). This indicates the benchmark's broken provided function code was the proximate cause of the wrong final answer rather than an unavoidable reasoning gap. If the scaffold had provided a correct `gain()` (log mirror loss) and consistent import rules, the agent's earlier correct implementation (with `math.log` and `np.exp`) would likely have passed. | evidence: Broken benchmark-provided `gain()` in the new task: `alpha_mirror = (1 / (2 * L)) * (-1 * ((R1 * R2) ** -1).ln())` and other contradictory overwrites. Agent was instructed: ""calculate ... with the functions gain(...) and current_density(...) given."" The agent's final output used the incorrect scaffolded mirror-loss form: `alpha_mirror = (1 / (2 * L)) * (1 / (R1 * R2)) ** 0.5` (in the last `threshold_current`). The system cleanup step also forced removal of imports: ""Please remove any dependencies or imports..."", conflicting with dependency instructions and the provided `gain()` relying on `math`.",scicode_scicode_tool_calling_agent_claudeopus41_1755801688_UPLOAD
21,scicode,0.00,0,"existence_reasoning: The benchmark task is well-formed and solvable in the stated environment: implement `alpha(lambda_i, x, lambda0, alpha0)` using the already-provided `alpha_eff` and `m_eff`. The required computation is straightforward normalization via a reference absorption coefficient. No template misalignment or impossible dependency constraints are present; numpy is allowed and not strictly needed. While some earlier parts of the overall multi-step prompt include under-specified physics for `alpha_eff`, this specific graded step (constructing `alpha` from `alpha_eff`) is sufficiently specified. | causation_reasoning: The run failure was due to the agent’s tool-call/code-formatting errors (unterminated triple-quoted strings when trying to call `final_answer` with markdown code fences), not due to any intrinsic benchmark deficiency. The agent eventually produced a correct `alpha` function, indicating the task was solvable once formatting mistakes were avoided. | evidence: Failure is triggered by agent-introduced syntax errors during tool calls: ""Code parsing failed on line 2 due to: SyntaxError ... Error: unterminated triple-quoted string literal"" when constructing `solution = '''```python`... and again: ""Code parsing failed on line 1 ... final_answer(\""\""\""```python"" ... ""unterminated triple-quoted string literal"". The benchmark itself provides consistent function headers and dependencies; later the agent outputs a valid implementation: `def alpha(lambda_i, x, lambda0, alpha0): ... alpha_eff_ref = alpha_eff(lambda0, 0, 1) ... C = alpha0 / alpha_eff_ref ... alpha_final = alpha_eff(lambda_i, x, C)`.",scicode_scicode_tool_calling_agent_claudeopus41_1755801688_UPLOAD
27,scicode,1.00,0,"existence_reasoning: The benchmark instructs the agent to implement using NumPy (""DEPENDENCIES: ... import numpy as np""), and also to ""test that function using the python interpreter"" tool. However, the provided python_interpreter environment explicitly disallows importing NumPy (it only allows a small whitelist of standard libraries). This is an intrinsic conflict in the benchmark setup: an agent following instructions to use NumPy and then test in the given interpreter will hit an unavoidable import failure. A perfect agent cannot both (a) adhere to the mandated dependency and (b) run tests in the provided tool environment as instructed. | causation_reasoning: The agent's failure is directly triggered by this environment mismatch: when attempting to test a NumPy-based implementation, the interpreter errors because NumPy imports are forbidden. This forced the agent into workaround behavior (testing with math instead of NumPy, later re-implementing logic inline). The run is marked failed, and the trace shows the blocking error came from the benchmark/tool constraints rather than an algorithmic impossibility. If NumPy were allowed in the interpreter (or if testing instructions matched allowed imports), the agent could have tested and iterated normally, likely avoiding cascading inconsistencies (e.g., later duplicating/copying incorrect capacitance logic). | evidence: Interpreter restriction: ""Import of numpy is not allowed. Authorized imports are: ['itertools', 'random', ...]"" when the agent tried to test code containing ""import numpy as np"".
Benchmark requirement: ""DEPENDENCIES: ... import numpy as np"" and ""Then test that function using the python interpreter"".
Failure point: ""Code execution failed ... due to: InterpreterError: ... import numpy as np ... Import of numpy is not allowed.""",scicode_scicode_tool_calling_agent_claudeopus41_1755801688_UPLOAD
39,scicode,1.00,0,"existence_reasoning: The benchmark asks for an R_coefficient implementation that “uses hyperbolic sine if theta is complex”, but it never provides the actual reflection-coefficient formula in terms of the transfer matrix (A,B,C,D), ambient/substrate indices, polarization/impedance convention, or how θ is supposed to enter (e.g., via Chebyshev/U_{N-1} trace relations for M^N). Multiple incompatible conventions exist for transfer matrices and for r,R extraction, so without specifying incident/exit media (n0, ns) and the exact expression for r (and thus R=|r|^2), the task is underdetermined. Additionally, the prompt says “The output should be a tuple of the matrix element (A,B,C,D)” but the provided matrix_elements returns a 2x2 matrix (list-of-lists in later scaffold), creating inconsistent expectations about downstream usage. | causation_reasoning: The agent failed because it had to guess an unspecified physics formula, producing an ad-hoc expression combining |sin(Nθ)/sin(θ)|^2 with a separate “factor=(n1/n2)^(2N)” term. This is not derivable from the benchmark materials and would likely not match the hidden grader’s expected formula. Even a perfect agent cannot know which exact R formula the benchmark intends given the missing boundary conditions and conventions. Thus the intrinsic underspecification is the proximate cause of failure. | evidence: Prompt for R_coefficient: “Provide a function to calculate the reflection coefficient R with the stack pairs N given. Pay attention to θ as if it is complex, hyperbolic sine function is needed instead of sine function.” No formula for R, no n0/ns, no r-from-(A,B,C,D) convention.
Earlier DBR formula found by agent includes n_o and n_s: “R = [(n_o(n_2)^(2N)-n_s(n_1)^(2N))/(n_o(n_2)^(2N)+n_s(n_1)^(2N))]^2” but benchmark never supplies n_o or n_s.
Interface mismatch: initial step states “output should be a tuple of the matrix element (A,B,C,D)” while provided scaffold returns “matrix” 2x2.
Agent guess shows the ambiguity: “The formula … typically involves: For real θ: R = |sin(Nθ)/sin(θ)|² * |some factor|² …” and then uses “factor = (n1 / n2) ** (2 * N)”, evidencing a forced guess due to missing spec.",scicode_scicode_tool_calling_agent_claudeopus41_1755801688_UPLOAD
24,scicode,1.00,0,"existence_reasoning: The benchmark environment is internally inconsistent: the prompt specifies solutions may use `import numpy as np`, but the provided `python_interpreter` tool explicitly forbids importing numpy (allowed imports list excludes numpy). This means any agent following the task's dependency instruction and attempting to test code with the provided interpreter will hit a systematic ImportError/InterpreterError. This is an intrinsic benchmark formation deficiency because it is a contradiction between required dependency and available execution environment. | causation_reasoning: The agent's run failed due to this environment contradiction when it attempted to test the LaxF implementation using the python_interpreter with `import numpy as np`. The tool rejected numpy imports, halting that attempt. Although the agent later tested without numpy, the run is marked failed and the proximate failure observed in-trace is the numpy import prohibition. A perfect agent cannot both obey the dependency requirement (numpy) and use the provided interpreter for testing as instructed, so the deficiency directly causes failure in this run. | evidence: Tool spec: ""This code can only import the following python libraries: ['unicodedata', 'math', ... 'itertools']"" (numpy absent) while the task requires: ""DEPENDENCIES: ... import numpy as np"".
Failure event: ""InterpreterError: Import of numpy is not allowed. Authorized imports are: ['unicodedata', 'math', ...]"" when running code that starts with ""import numpy as np"".",scicode_scicode_tool_calling_agent_claudeopus41_1755801688_UPLOAD
45,scicode,0.00,0,"existence_reasoning: The benchmark task as posed (implementing add_dirichlet_bc, then add_neumann_bc) is well-specified and solvable with the stated dependency (numpy). Requirements about excluding corners and using forward/backward differences are implementable without additional missing information (grid spacing can be assumed to be 1 in index units as the agent did, consistent with typical templates). No template/evaluation misalignment is evident in the final stage where the agent produced a valid function for add_neumann_bc. The earlier failure around final_answer was due to the agent formatting/tool misuse rather than an impossible or contradictory benchmark setup. | causation_reasoning: The run failure was caused by the agent producing an invalid tool call / malformed string when attempting to submit via final_answer: it embedded markdown fences inside a triple-quoted string, leading to a SyntaxError ('unterminated triple-quoted string literal'). This is an agent error (output formatting/tool invocation), not a benchmark formation deficiency. After correction, the agent was able to produce correct functions, showing the task itself was executable. | evidence: Failure point: ""Error: Code parsing failed on line 1 due to: SyntaxError\nfinal_answer(\""\""\""```python              ^\nError: unterminated triple-quoted string literal"". This occurred because the agent wrote: ""final_answer(\""\""\""```python\nimport numpy as np\n...```\""\""\"")"". Later the agent successfully outputs a valid add_dirichlet_bc and add_neumann_bc implementation, indicating the task is solvable.",scicode_scicode_tool_calling_agent_claudeopus41_1755801688_UPLOAD
55,scicode,0.00,0,"existence_reasoning: The task specification is coherent and solvable in the stated environment: implement functions (solve_SH, structure_factor, analyze_structure_factor, SH_pattern_formation) using numpy FFTs and scipy.signal utilities. No template/signature mismatch is evident; required dependencies are available; periodic pseudo-spectral method and structure-factor computations are standard. Although web_search timed out, Wikipedia fallback worked and is not required to solve the task. No contradiction between requirements and environment is shown. | causation_reasoning: The recorded failure is due to the agent's own malformed tool call / output formatting, not an intrinsic benchmark deficiency. Specifically, the agent attempted to call final_answer with an unterminated triple-quoted string and embedded markdown fences, producing a SyntaxError in the tool-call code. This is an agent implementation/formatting error; a correct agent could return the code without causing a parsing error. | evidence: Failure event: ""Error: unterminated triple-quoted string literal ... final_answer(\""\""\""```python"". Earlier web_search timeout is incidental: ""Web search failed ... operation timed out). Falling back to Wikipedia."" The tasks themselves provide clear headers and expected outputs for solve_SH / structure_factor / analyze_structure_factor / SH_pattern_formation without impossible constraints.",scicode_scicode_tool_calling_agent_claudeopus41_1755801688_UPLOAD
46,scicode,1.00,0,"existence_reasoning: The benchmark/evaluation context is internally inconsistent about what the model should output. The task asks for a full solution implementing a Metropolis function (and earlier, full classes), but the system later forces a post-processing rule: ""Your response should ONLY consist of one python function"" and to remove class code, which makes it impossible to provide the requested class-based or multi-definition solution in the final output format. This indicates a template/harness misalignment: the grading apparatus appears to re-prompt with constraints incompatible with the original spec. | causation_reasoning: The run is marked failed even though the agent produced a correct `metropolis` implementation earlier. The failure is attributable to the evaluation harness switching requirements midstream to demand a single-function output and stripping code, which would break expected interfaces (e.g., missing `hamiltonian` usage and/or required class definitions). This conflict would impede any agent: complying with the later system constraint prevents delivering the complete program required by the original prompt, leading to test/harness failure unrelated to reasoning. | evidence: System constraint: ""You are a tool ... Your response should ONLY consist of one python function. Please remove any dependencies or imports from the code and any code that is not part of a function or class."" contrasted with earlier response guidelines: ""Write the complete and executable Python program for the next step in a single block"" and tasks requiring classes (e.g., ""Write a Python class for Hamiltonian..."").
Agent run metadata shows failure: {""failed"": true}.
The `metropolis` spec mentions a Hamiltonian object: ""given ... a Hamiltonian object `hamiltonian`"" but the provided function header lacks it and the agent implementation ignores it, consistent with confusion from misaligned instructions.",scicode_scicode_tool_calling_agent_claudeopus41_1755801688_UPLOAD
52,scicode,0.00,0,"existence_reasoning: The benchmark interaction environment has constraints that are not accounted for in the task workflow: (a) web_search frequently times out and falls back to unrelated Wikipedia pages, making the suggested “look up” steps unreliable; and (b) the python tool enforces a hard max-operations limit, which can be hit by a straightforward implementation that repeatedly calls an expensive ODE solve inside an energy scan. These are intrinsic environment limitations not reflected in the task specification and can impede many agents if they follow the naive/standard shooting+scan approach without optimization guidance. | causation_reasoning: Despite the above deficiencies, the run’s recorded failure is not shown to be caused by them at the end-state. The max-operations error occurred during the agent’s large, self-chosen test (500 radii, 200 energies) rather than during the required function implementation. After encountering the limit, the agent produced an “optimized” FindBoundStates that reduces evaluations. The final output still appears to fail the benchmark, but the trace does not show an evaluation harness error tied to the environment; instead, the final assistant response changed the algorithm (manual bisection, extra Shoot calls) and also violated dependency guidelines by not using scipy.optimize in the final cleaned version (it removed imports and replaced brentq with custom loop), suggesting agent-side implementation/format issues rather than an unavoidable benchmark defect. A capable agent could implement FindBoundStates efficiently within limits (coarse scan + brentq) without web_search and without exceeding operation limits. | evidence: Environment constraint evidence: ""InterpreterError: Reached the max number of operations of 10000000"" occurred when running a heavy test: ""bound_states = FindBoundStates(y0, R, l, nmax, Esearch)"" with ""R = np.logspace(-5, 2, 500)"" and ""Esearch = np.linspace(-0.6, -0.01, 200)"".
Web unreliability: ""Web search failed ... operation timed out). Falling back to Wikipedia."" followed by irrelevant pages like ""Timeline of quantum computing and communication"" and ""List of Russian people"".
Agent-side issues: after optimizing with brentq in one version, the later final response replaced it with a custom bisection and removed SciPy usage (contrary to earlier dependencies context), increasing Shoot calls inside a while loop, which risks performance again.",scicode_scicode_tool_calling_agent_claudeopus41_1755801688_UPLOAD
48,scicode,1.00,0,"existence_reasoning: The benchmark instructions are internally inconsistent about imports/dependencies. The task specification says: ""Use only the following dependencies... Do not include these dependencies at the beginning of your code"" and earlier the system/tooling also instructs to remove imports, yet the grading environment evidently executes the submitted function in isolation unless it includes needed imports. In the final produced `chi_cal`, the agent included `import numpy as np` and `from scipy import interpolate` inside the function, which violates the benchmark rule but is a common workaround when the harness does not preload imports. This indicates a scaffold/evaluation mismatch: either the environment should preload `np`/`interpolate`, or the instruction should allow local imports. As written, a correct solution is placed in a double-bind: follow the rule and risk NameError, or violate it and risk failing style/format checks. | causation_reasoning: The run is marked failed even though the agent produced a plausible `chi_cal` implementation. The only clear benchmark-related failure mode visible is the import rule conflict: the agent's final answer explicitly adds imports inside the function (and previously relied on external `np`/`interpolate` without imports). If the benchmark grader enforces the ""do not include dependencies"" rule, the submission fails despite correct logic. Conversely, if the grader does not preload imports, then following the rule would also fail. Thus the intrinsic scaffold inconsistency is the proximate reason this run could not satisfy the benchmark constraints reliably. | evidence: Instruction conflict: ""Use only the following dependencies... Do not include these dependencies at the beginning of your code."" Final submission includes imports inside function: `def chi_cal(...):\n    import numpy as np\n    from scipy import interpolate`. Prior code assumed globals: `S_interp = interpolate.interp1d(...)` without importing in the final block. The run metadata indicates failure: `{ ""failed"": true }` despite having an implemented `chi_cal`.",scicode_scicode_tool_calling_agent_claudeopus41_1755801688_UPLOAD
53,scicode,0.00,1,"existence_reasoning: No intrinsic formation deficiency is indicated. The benchmark provides consistent function headers and clear requirements. The dependencies listed (numpy, scipy.interpolate.interp1d, numpy.fft) are adequate for the required implementations. While the execution environment’s web_search tool times out repeatedly, web search is not required to solve the tasks (the agent successfully implemented functions without it). The occasional interpreter “max number of operations” limit is an environment constraint, but it does not make the task unsolvable for capable agents; simulations can be run with smaller T, smaller populations, or fewer steps, and the final deliverable is code, not a long simulation run. | causation_reasoning: The agent did not fail the task. The run metadata explicitly shows ""failed"": false and the agent produced final code for predator_prey. Therefore, even if minor issues existed (e.g., web_search timeouts or operation limits during exploratory testing), they did not cause a failure in this run. | evidence: Run metadata: ""failed"": false.
Agent produced final implementation: 
""def predator_prey(prey, predator, alpha, beta, gamma, T):\n    time_cor, prey_evol, predator_evol, eco_event = evolve_LV(...)\n    if eco_event == \""coexistence\"": ..."".
Environment constraint observed during testing but not fatal: ""InterpreterError: Reached the max number of operations of 10000000"".
Web search unreliability: ""Web search failed ... operation timed out). Falling back to Wikipedia.""",scicode_scicode_tool_calling_agent_claudeopus41_1755801688_UPLOAD
50,scicode,1.00,0,"existence_reasoning: The benchmark specifies contradictory constraints across steps about which np.random functions are allowed. The earlier provided helper function find_equilibrium (part of the benchmark context for the final step) uses np.random.randint and np.random.rand, while the final step (spin_glass) explicitly restricts np.random usage to only randn and choice. Any correct implementation of spin_glass that calls the provided find_equilibrium will necessarily violate the final-step constraint (by indirectly using randint/rand), creating an unsatisfiable requirement if the grader enforces the randn/choice-only rule over the whole executed code path. | causation_reasoning: The agent implemented spin_glass in a way that correctly uses only np.random.randn and np.random.choice within spin_glass itself, but it calls find_equilibrium, which uses np.random.randint and np.random.rand. If the run is marked failed due to the random-function restriction, that failure is caused by the benchmark’s contradictory constraints rather than the agent’s logic. A perfect agent cannot satisfy both: (a) use the provided find_equilibrium as given and (b) ensure only randn/choice are used in this part of execution. | evidence: Final-step constraint: ""If using functions from np.random, only \""randn\"" and \""choice\"" are allowed in this part."" Provided helper uses disallowed RNG calls: in find_equilibrium: ""i = np.random.randint(0, N)"" and ""if np.random.rand() < acceptance_prob:"". Agent’s spin_glass calls that helper: ""equilibrium_spins = find_equilibrium(initial_spins, N, T, J, num_steps)"".",scicode_scicode_tool_calling_agent_claudeopus41_1755801688_UPLOAD
