task_id,criteria,grade,correct,explanation,model_run
5,scicode,1.00,0,"existence_reasoning: The benchmark/task specification requires implementing Lanczos using NumPy (explicitly: ""Use only... import numpy as np""), but the provided python_interpreter environment forbids importing NumPy (it allows only a small whitelist of stdlib modules). This is an intrinsic mismatch between required dependency and the execution environment used for the mandated testing steps, impeding any agent from following the instructions to implement and test with NumPy inside the interpreter. | causation_reasoning: The run fails at the testing stage because importing NumPy is impossible in the interpreter, preventing syntax/runtime testing and unit testing as required by the approach guidelines. The failure is directly triggered by the environment rejecting the required dependency. While the agent also attempted forbidden operations (open, compile), the primary blocking issue appears first and fundamentally: they cannot run any NumPy-based implementation in the provided interpreter, so they cannot complete the required test/debug loop; thus the benchmark deficiency is the proximate cause of failure. | evidence: Task requirement: ""DEPENDENCIES: Use only the following dependencies... import numpy as np"" and guidelines: ""Then test that function using the python interpreter"". Interpreter error: ""Import of numpy is not allowed. Authorized imports are: ['math', 'statistics', 'stat', 'unicodedata', 'datetime', 'random', 'itertools', 'time', 'collections', 'queue', 're']"" (after attempting `import numpy as np`).",scicode_scicode_tool_calling_agent_claudeopus41_1755801688_UPLOAD
9,scicode,1.00,0,"existence_reasoning: The benchmark environment appears not to support Python's matrix multiplication operator '@' (MatMult). The task specification assumes standard NumPy/Python behavior for matrix operations (and even encourages testing in the provided interpreter), but the execution environment throws NotImplementedError for MatMult. This is an environment mismatch: valid, standard Python/NumPy code cannot run as expected, creating a structural barrier for agents that implement the natural solution using '@'. | causation_reasoning: The agent's run failed at the unit test stage specifically because using '@' for matrix multiplication caused a NotImplementedError. This was not due to algorithmic misunderstanding; the initial implementation was correct and syntactically valid. The failure was triggered by the environment's lack of support for MatMult, which is intrinsic to the benchmark/tooling rather than the agent's logic. Although the agent later worked around it with np.dot, the recorded failure event and task marked failed stem from this benchmark/tool limitation. | evidence: Error shown by harness: ""Code execution failed at line 'b = A @ x_true' due to: NotImplementedError: Binary operation MatMult is not implemented."" Agent also notes: ""Matrix multiplication using @ operator causes NotImplementedError in the test environment.""",scicode_scicode_tool_calling_agent_claudeopus41_1755801688_UPLOAD
2,scicode,1.00,0,"existence_reasoning: The benchmark specification requires using `from scipy.integrate import simps`, but in the provided execution environment `scipy.integrate` does not contain `simps` (likely only `simpson` exists). This is an intrinsic dependency/interface mismatch: a correct agent following the benchmark's mandated import will trigger an ImportError/AttributeError. This constitutes an obsolete/deprecated specification in the task's dependency contract. | causation_reasoning: The agent's run fails directly at the mandated import step, before any algorithmic correctness can be evaluated. Since the environment rejects `simps`, any solution adhering to the benchmark's required dependencies will fail similarly. If the benchmark were corrected (e.g., allow `simpson` or ensure `simps` exists), the agent could proceed to implement/test the function; the observed failure is thus proximately caused by the benchmark's dependency mismatch rather than the agent's logic. | evidence: Trace shows failure on required dependency import: ""Code execution failed at line 'from scipy.integrate import simps' due to: InterpreterError: Module scipy.integrate has no attribute simps"". The task explicitly mandates: ""DEPENDENCIES: ... from scipy.integrate import simps"".",scicode_scicode_tool_calling_agent_claudeopus41_1755801688_UPLOAD
74,scicode,0.00,1,"existence_reasoning: The benchmark/task description specifies that only `numpy` may be used (""DEPENDENCIES: ... import numpy as np"") and the agent indeed uses `np`. However, the provided `python_interpreter` tool environment explicitly restricts imports to a whitelist that does NOT include numpy (""This code can only import the following python libraries: ...""). This is an intrinsic contradiction between allowed dependencies and the execution tool used for testing within the benchmark setup, which could impede agents that follow the instructions and attempt to test with the provided interpreter. | causation_reasoning: Despite the intrinsic dependency/environment mismatch, it did not cause a failure in this run. The agent's run is marked `failed: false`, and their test executions succeeded and produced QR-consistent results. Therefore, the agent did not fail, so no deficiency could have caused failure here. | evidence: Task dependency requirement: ""DEPENDENCIES: Use only the following dependencies... import numpy as np"".
Tool limitation: ""python_interpreter... can only import the following python libraries: ['unicodedata', ... 'time']"" (numpy absent).
Run outcome: agent run metadata shows ""failed"": false.
Successful outputs shown: ""Result R: ..."" and comparison with ""Numpy's R matrix:"" with matching values.",scicode_scicode_tool_calling_agent_claudeopus41_1755801688_UPLOAD
8,scicode,0.00,1,"existence_reasoning: The task is solvable with the stated dependencies (numpy FFT). The function header is clear, inputs/outputs are specified, and there is no contradiction with the environment. While the term “cross-shaped band high pass” is somewhat ambiguous (could mean passing a cross vs blocking a cross, and how to interpret “bandwidth frequency”), it is still implementable using standard reasonable conventions; this does not rise to an intrinsic benchmark deficiency that would impede any agent. | causation_reasoning: There was no benchmark failure in this run. The agent produced a valid function and the run metadata indicates success (failed: false). Therefore no intrinsic deficiency could have caused a failure here. | evidence: Run metadata: ""failed"": false.
Agent successfully returned a python function at the end: ""def apply_cshband_pass_filter(image_array, bandwidth): ... return T, filtered_image"".
Tooling and dependencies were available and used without errors (e.g., fft2/ifft2/fftshift/ifftshift).",scicode_scicode_tool_calling_agent_claudeopus41_1755801688_UPLOAD
14,scicode,0.00,0,"existence_reasoning: The benchmark task is solvable as stated: implement calculate_msd using only numpy and the provided harmonic_mannella_leapfrog function, averaging Navg trajectories with Maxwell-distributed initial conditions. The function signature and dependency constraints are consistent with the environment. There is no intrinsic contradiction that would block a competent agent from returning a valid function body. | causation_reasoning: The recorded failure arises from the agent's incorrect output formatting/tool usage, not from the task formation. The agent attempted to call final_answer with embedded markdown fences and mismanaged triple-quoted strings, causing a SyntaxError in the evaluation/parsing stage. This is an agent implementation/formatting error; the benchmark did not force the agent into that mistake. Additionally, earlier 'max number of operations' errors came from the agent's heavy testing loops (Navg * steps * multiple trials), not from an impossible benchmark requirement. | evidence: Parsing failure: ""Code parsing failed on line 1 due to: SyntaxError\nfinal_answer(\""\""\""```python              ^\nError: unterminated triple-quoted string literal"".\nEarlier resource error due to agent's test workload: ""InterpreterError: Reached the max number of operations of 10000000"" when running multiple simulations/long t0. The task itself only required implementing calculate_msd, and the final correct-looking function was later produced.",scicode_scicode_tool_calling_agent_claudeopus41_1755801688_UPLOAD
17,scicode,1.00,0,"existence_reasoning: The benchmark asks to ""perform DOS integration within a single tetrahedron"" for the linear tetrahedron method but provides no equations, normalization, or definition of what the returned ""result"" represents (e.g., integrated DOS/IDoS vs DOS, per-tetrahedron weight, volume factors, units). Without the standard piecewise analytic formulas (or a cited reference), multiple incompatible implementations are plausible, so the task is intrinsically underspecified. A correct solution cannot be uniquely derived from the prompt and provided code alone; it implicitly requires external domain knowledge and specific conventions not included in the benchmark materials. | causation_reasoning: The agent’s failure is driven by the missing specification: they repeatedly attempted to look up formulas via web_search/wikipedia but the environment could not retrieve relevant sources, and then they produced an ad-hoc piecewise function without confirmation it matches the benchmark’s expected convention. Because the benchmark did not provide the required formulas and the tool-based lookup failed, even a capable agent cannot reliably produce the exact expected implementation; thus the intrinsic underspecification (compounded by inability to access references) is the proximate cause of failure. | evidence: Prompt gap: ""Write a function to perform DOS integration within a single tetrahedron. Consider the different scenarios..."" with no formulas/normalization.
Agent explicitly notes missing info: ""Facts still to look up - The specific formulas for DOS integration in the linear tetrahedron method"".
Lookup attempts fail: ""Web search failed ... operation timed out ... Falling back to Wikipedia. No Wikipedia page found..."" and later Wikipedia returns irrelevant pages (""Tetrahedron"", ""List of algorithms"").
Agent then guesses: ""Let me try to implement the integrate_DOS function based on my understanding... I'll implement the standard formulas for each case.""",scicode_scicode_tool_calling_agent_claudeopus41_1755801688_UPLOAD
15,scicode,1.00,0,"existence_reasoning: The benchmark's stated allowed dependencies for the solution are ""import numpy as np"" and ""from scipy import linalg, sparse"", but the execution environment/tooling shown in the trace does not support importing SciPy (the python_interpreter tool only allows a small whitelist of stdlib modules). This creates an intrinsic contradiction: a correct implementation per the benchmark will likely require scipy.linalg.solve (or equivalent), yet the environment cannot run SciPy. Additionally, the task expects complex-valued evolution (Gaussian wave packet with exp(i kappa x)), but the earlier provided init_AB constructs real float matrices, implying an inconsistent formulation of the Schrödinger CN scheme (which typically yields complex matrices). The core blocking issue for evaluation is the SciPy availability mismatch. | causation_reasoning: The run failed because the agent's final crank_nicolson solution depends on np and linalg (SciPy) and on init_AB being available, but the benchmark/tooling context cannot execute SciPy imports/functions. This is visible in the agent repeatedly (and incorrectly) calling web_search/wikipedia_search from within python_interpreter, indicating tool/environment limitations, and the benchmark's dependency specification contradicts the available interpreter. A capable agent cannot satisfy both constraints (use SciPy as required; run in an environment that disallows SciPy). Fixing the benchmark to match the environment (e.g., allow SciPy or require pure-numpy) would remove the failure mode. | evidence: Tool definition: ""python_interpreter... can only import the following python libraries: ['collections', 'statistics', 'stat', 'random', 'queue', 'time', 'math', 'itertools', 're', 'datetime', 'unicodedata']"" while the task states ""DEPENDENCIES: import numpy as np; from scipy import linalg, sparse"".
Agent solution uses SciPy: ""from scipy import linalg"" and later ""psi_interior = linalg.solve(A, b_psi)"".
Environment mismatch shown by tool misuse/fallback: ""Calling tools: ... python_interpreter ... result = web_search(...)"" followed by ""Web search rate limited. Falling back to Wikipedia."" (indicates the limited tool environment rather than normal Python execution).",scicode_scicode_tool_calling_agent_claudeopus41_1755801688_UPLOAD
18,scicode,1.00,0,"existence_reasoning: The benchmark requires the final response to be only the next-step function (NURBS_2D) and forbids including dependencies/imports. However, the provided previous-step Bspline returns Python lists, while the expected output for both steps is a NumPy array. The agent’s NURBS_2D correctly uses `np.array([N])`, but since imports are forbidden in the submission and the task does not guarantee that `np` is available in the evaluation scope, the next-step function may raise NameError at runtime. This is a structural mismatch: the template forbids including the required import while the function as specified requires NumPy to satisfy the output contract. | causation_reasoning: The agent’s final NURBS_2D uses `np.array` but the final required output block contains no `import numpy as np`. If the evaluation harness does not pre-import numpy into the module namespace as `np` (not guaranteed by the prompt itself), execution fails with NameError. This failure is caused by the benchmark’s conflicting constraints (must use numpy, but must not include imports) combined with reliance on a global `np` symbol. The agent otherwise implemented the correct NURBS formula and even validated it in-tool where numpy was imported, indicating failure would stem from the benchmark harness/environment rather than agent logic. | evidence: Prompt: ""DEPENDENCIES: Use only the following dependencies in your solution. Do not include these dependencies at the beginning of your code.\n\nimport numpy as np"" and ""Write the complete and executable Python program ..."" while requiring output as ""1d array"".
Agent final submission: `N = np.array([N])` with no import in the returned code block: ""def NURBS_2D(...): ... N = np.array([N])"".
Also prior step code returns lists (`return [1.0]`), but task text says outputs are arrays, showing inconsistent scaffolding.",scicode_scicode_tool_calling_agent_claudeopus41_1755801688_UPLOAD
16,scicode,1.00,0,"existence_reasoning: The benchmark specifies the only allowed dependency as `import numpy as np` (and explicitly tells the agent not to include imports). Therefore, any correct solution must reference NumPy as `np` inside the function body. However, the evaluation/scaffolding layer later forces the submission through a tool that only extracts a single function and removes imports, and the agent-facing prompt does not explicitly guarantee that `np` will be available in the execution namespace during grading. In the provided run, the system's extraction step accepts a function that uses `numpy` (not `np`) without adding an import or alias. This mismatch between the dependency specification (`np`) and the extracted function's symbol usage (`numpy`) is a formation/scaffolding issue that can make otherwise-correct Davidson implementations fail at runtime due to `NameError`. | causation_reasoning: The run fails because the final extracted `davidson_solver` function uses `numpy.*` (e.g., `numpy.random.randn`) even though the benchmark dependency contract indicates `numpy` is imported as `np`. With imports removed by the system extraction step, `numpy` is very likely undefined in the grading environment, causing immediate runtime failure regardless of the algorithmic logic. This is directly induced by the benchmark/evaluation apparatus interaction: it both restricts imports and requires a specific alias, but the final evaluation path can easily end up with an undefined symbol. Fixing the formation (ensuring consistent aliasing or guaranteeing availability of `np`/`numpy`) would remove the proximate failure cause. | evidence: Dependency specification: ""Use only the following dependencies... import math\nimport numpy as np"" and ""Do not include these dependencies at the beginning of your code."" Final submission uses the wrong symbol: `v = numpy.random.randn(n)`, `V_mat = numpy.array(V).T`, `eigvals, eigvecs = numpy.linalg.eigh(H)`, etc. The system extraction instruction: ""Remove any dependencies or imports from the code"" and ""Your response should ONLY consist of one python function."" Agent's earlier working draft used `np` (e.g., ""import numpy as np"" then `np.random.randn`), but the final provided function uses `numpy`.",scicode_scicode_tool_calling_agent_claudeopus41_1755801688_UPLOAD
20,scicode,1.00,0,"existence_reasoning: The benchmark instructs the agent to use the provided tools (notably the python interpreter) to test and debug the function. However, the provided python_interpreter environment appears to have a broken/unsupported context manager implementation, causing errors on valid Python code that uses `with ...:`. This is an intrinsic environment/tooling deficiency: correct code that should run in standard Python fails due to the harness, impeding any agent that follows the testing/debugging guideline and uses common numpy patterns (e.g., `np.errstate`). | causation_reasoning: The agent’s run fails at the testing step due to the interpreter throwing `AttributeError: 'NoneType' object has no attribute '__exit__'` when executing a `with np.errstate(...)` block. This failure is directly caused by the environment/tooling deficiency, not by the agent’s algorithmic logic. After the error, the agent had to change approach (removing `with np.errstate`) to proceed. The run is marked failed; the proximate cause shown in the trace is the interpreter error stemming from the broken context manager handling. | evidence: Tool execution failure during testing: ""Error: Code execution failed ... AttributeError: 'NoneType' object has no attribute '__exit__'"" immediately after code containing ""with np.errstate(over='raise', invalid='raise')"". The rubric-required testing step relied on python_interpreter, and the error arose from valid Python syntax/semantics rather than agent logic.",scicode_scicode_tool_calling_agent_claudeopus41_1755801688_UPLOAD
25,scicode,0.00,1,"existence_reasoning: The benchmark/environment (as exercised by the provided python_interpreter tool) does not implement the matrix-multiplication AST/operator (MatMult / '@'), raising NotImplementedError. However, the task materials and provided function code for ResourcesUpdate explicitly use '@' (""consumption_rate = c.T @ spc * res""), which is a standard NumPy idiom. This is an intrinsic mismatch between the assumed Python/NumPy execution semantics and the actual evaluation environment, and would systematically break solutions that follow the template literally. | causation_reasoning: Despite the deficiency, the agent ultimately succeeded (run metadata: ""failed"": false) by switching to np.dot during debugging. Therefore the intrinsic deficiency did not cause a task failure in this run. The agent did encounter the deficiency mid-run (NotImplementedError) but worked around it and completed the task. | evidence: 1) Environment failure on '@': ""NotImplementedError: Binary operation MatMult is not implemented."" (triggered at ""g_spc = SpeciesGrowth(...)"" initially and later in Simulate test).
2) Benchmark-provided code uses '@': ResourcesUpdate snippet: ""consumption_rate = c.T @ spc * res"".
3) Agent workaround: reimplemented with np.dot: ""consumption_rate = np.dot(c.T, spc) * res"".
4) No final failure: agent run metadata shows ""failed"": false.",scicode_scicode_tool_calling_agent_claudeopus41_1755801688_UPLOAD
26,scicode,0.00,0,"existence_reasoning: The benchmark task as posed is solvable in the stated environment: implement OneCycle and then SimulatedCycles using the provided SpeciesGrowth/OneCycle context and allowed dependencies. There is no inherent contradiction or missing dependency that would prevent any agent from producing a valid function. Although biological details (e.g., yield/stoichiometry) are underspecified, the benchmark’s own preceding code implies a simple 1:1 mapping between population increase and resource consumption (as used in the provided OneCycle), so this is not a fatal underspecification for passing the benchmark. | causation_reasoning: The recorded failure is not due to a benchmark formation issue but due to an agent-output formatting/tool-call error: the agent invoked final_answer with an unterminated triple-quoted string that the system attempted to parse as code, producing a SyntaxError. This is an agent implementation/formatting mistake. Afterward, the agent was able to output correct code blocks/functions, indicating the task itself was feasible. | evidence: Failure point: ""Call id: call_7\nError:\nCode parsing failed on line 1 due to: SyntaxError\nfinal_answer(\""\""\""```python              ^\nError: unterminated triple-quoted string literal"". This shows the error was caused by malformed quoting in the agent’s final_answer call, not by benchmark constraints. Earlier evidence of feasibility: successful tests and correct outputs for SpeciesGrowth/OneCycle/SimulatedCycles (e.g., ""Function defined successfully"", and later the agent provides a clean SimulatedCycles implementation).",scicode_scicode_tool_calling_agent_claudeopus41_1755801688_UPLOAD
28,scicode,0.00,0,"existence_reasoning: The benchmark/scaffold shows conflicting expectations about how the agent should deliver the final solution: earlier it instructs to output a plain Python block, but the environment also provides a `final_answer(answer)` tool and the agent is prompted to call it. This mismatch can mislead agents into embedding markdown/triple-quoted code inside a function call, which is not valid Python. Additionally, the trace shows the agent repeatedly using `python_interpreter` to call `web_search`, implying the harness/tooling interface is confusingly presented/used. These are formation/scaffolding issues that could plausibly trip agents. | causation_reasoning: Despite the scaffold confusion, the proximate failure in this run is the agent’s incorrect construction of the `final_answer` call with an unterminated triple-quoted string and markdown fences, causing a SyntaxError. This was an agent implementation/formatting error, not an unavoidable benchmark defect: the agent could have simply output the function in a code block as required. The benchmark did not make the task impossible; the failure stemmed from how the agent tried to wrap the final response. | evidence: Failure message: ""Error: unterminated triple-quoted string literal ... final_answer(\""\""\""```python ^"" and ""SyntaxError"".
Conflicting output patterns: response guidelines say ""Ensure your response is in the format of ```python```"" while the agent attempted tool wrapping: ""final_answer(""""""```python ... ```"""""")"".
Tooling confusion earlier: tool calls show `python_interpreter` invoked with `web_search(...)` inside the code snippet.",scicode_scicode_tool_calling_agent_claudeopus41_1755801688_UPLOAD
43,scicode,1.00,0,"existence_reasoning: The benchmark provides code for Pout_Nz_Calculation that uses np and solve_bvp but the task simultaneously instructs: ""Use only the following dependencies... Do not include these dependencies at the beginning of your code."" Since the provided function body (and the expected solution style) relies on np/solve_bvp but forbids importing them in the submission, this creates a structural mismatch: in a fresh execution context the function will raise NameError for np and/or solve_bvp. A correct benchmark template would either (a) include the imports outside the function in the harness, or (b) allow/require the contestant to include them, or (c) avoid using np/solve_bvp. The materials as shown do not guarantee availability of these symbols. | causation_reasoning: The run is marked failed, and the most direct, capability-independent cause indicated by the produced solution is reliance on undefined symbols. The final provided implementation of Pout_Nz_Calculation contains multiple references to np and solve_bvp without importing them inside the function, because of the benchmark instruction not to include imports. In the evaluation environment (which typically runs submitted code in isolation), this would cause immediate runtime failure (NameError), regardless of the agent’s reasoning. Thus the intrinsic template/constraints conflict is the proximate cause of failure. | evidence: Benchmark constraint: ""Use only the following dependencies in your solution. Do not include these dependencies at the beginning of your code.\n\nimport numpy as np\nfrom scipy.integrate import solve_bvp"".
Final submitted function uses undefined names: ""dydz = np.zeros(4)"", ""z = np.linspace(0, L, 100)"", and ""sol = solve_bvp(f, bc, z, y_init, tol=1e-6, max_nodes=1000)"" with no import statements inside or outside in the final output.
Run metadata indicates failure: ""\""failed\"": true"".",scicode_scicode_tool_calling_agent_claudeopus41_1755801688_UPLOAD
