task_id,criteria,grade,correct,explanation,model_run
54,scicode,1.00,0,"existence_reasoning: The benchmark requires solutions that use `numpy` (explicitly listed under DEPENDENCIES: `import numpy as np`), and the provided reference implementations also rely on `numpy`. However, the execution environment shown in the trace for tool-based testing (`python_interpreter`) does not permit importing numpy (allowed imports list excludes numpy). This is an intrinsic mismatch between the benchmark's required dependency set and the evaluation/tool environment, which would impede any agent from running or validating numpy-dependent code within that environment. | causation_reasoning: The run is marked failed despite the agent producing plausible implementations. Given the environment mismatch, any attempt to execute the final `solve` (and/or `assemble`, `stabilization`, `basis`) in the restricted interpreter would fail due to missing `numpy`. This deficiency is sufficient to cause failure independent of agent reasoning. The agent's own testing steps used `python_interpreter` but implicitly assumed numpy was available; the benchmark's dependency instruction conflicts with the actual tool constraints, making successful execution impossible in this context. | evidence: Tool specification: `python_interpreter` ""can only import the following python libraries: ['re', 'collections', 'math', 'datetime', 'itertools', 'stat', 'statistics', 'queue', 'random', 'unicodedata', 'time']"" (numpy not included).
Benchmark requirement: ""DEPENDENCIES: ... import numpy as np"".
Agent code relies on numpy throughout (e.g., `import numpy as np` in `assemble`, `stabilization`, and `solve`).
Run metadata indicates failure: `{ ""failed"": true }`.",scicode_scicode_tool_calling_agent_claudeopus41_1755801688_UPLOAD
79,scicode,1.00,0,"existence_reasoning: The benchmark’s tool-calling/evaluation setup is structurally inconsistent with the task’s response format. The agent is repeatedly prompted to return code wrapped as markdown (```python ... ```), but the execution/evaluation harness appears to parse the agent's response as Python code (not as plain text), causing SyntaxError when the agent attempts to wrap code in triple-quoted strings or include markdown fences inside an executable context. This is a mismatch between the instructed output format and what the harness actually executes/parses. | causation_reasoning: The agent’s failure is directly triggered by this mismatch: attempts to produce the required markdown-formatted final answer are interpreted as Python code by the harness, leading to parsing failures (unterminated triple-quoted string). A capable agent could avoid this by outputting raw code without embedding it inside Python string literals or tool calls, but the benchmark interaction explicitly pushes the agent to call `final_answer(...)` with markdown fences, which the harness then tries to parse as code. The proximate failure events are the harness parse errors, not the numerical/algorithmic content. | evidence: Web/tool execution shows the harness parsing agent output as Python and failing on formatting attempts:
- ""Error: unterminated triple-quoted string literal ... final_answer(\""\""\""```python"" (T0B70)
- ""Code parsing failed on line 1 ... solution = \""\""\""```python"" (T0B72)
- ""Code parsing failed on line 26 ... Error: unterminated triple-quoted string literal"" when trying to embed a docstring inside a triple-quoted wrapper passed to final_answer (T0B74).
These errors arise from trying to satisfy 'Ensure your response is in the format of ```python```' while the harness is executing/parsing the response as Python code.",scicode_scicode_tool_calling_agent_claudeopus41_1755801688_UPLOAD
57,scicode,0.00,0,"existence_reasoning: There are intrinsic issues in the benchmark setup: (1) The agent repeatedly calls web_search/wikipedia_search *inside* python_interpreter, even though the tool API is defined as separate tools. The trace shows the environment nevertheless executes web_search as a side effect of python_interpreter, but with frequent timeouts and irrelevant Wikipedia fallbacks. This indicates a mis-specified or brittle tool interface/assumption in the harness. (2) The prompt says ""Use only the following dependencies"" and ""Do not include these dependencies at the beginning of your code"" yet the solution requires numpy/scipy symbols (e.g., np) to exist; this can confuse placement/availability of imports. (3) The BoundStates step requires using previously defined functions, but later the agent includes nested redefinitions and even manual Simpson integration despite the stated requirement to use scipy.integrate.simpson, reflecting ambiguity about what is available/imported at evaluation time. These are formation/scaffolding issues that could impede consistent solutions. | causation_reasoning: Despite the above deficiencies, the proximate cause of failure in this run is the agent's own implementation choices leading to excessive computation and nonconforming output, not an unsolvable benchmark. The agent's BoundStates testing hit the execution limit: ""InterpreterError: Reached the max number of operations of 10000000"" when scanning energies with expensive Solve_Schrod evaluations. They then produced an 'optimized' BoundStates that returned an incorrect bound state (n=6, E=0.3152), showing algorithmic failure. A capable agent could implement BoundStates more efficiently (e.g., fewer grid points, reuse f(x), avoid full normalization each step, or use optimize.root_scalar on boundary mismatch) and pass within limits. Thus, deficiencies exist but did not force failure; the agent failed primarily due to inefficiency and incorrect shooting-state detection logic. | evidence: Tool/interface brittleness: ""Calling tools: ... python_interpreter ... arguments: 'search_result = web_search(...)'"" followed by ""⚠️ Web search failed ... Falling back to Wikipedia."" Dependency ambiguity: prompt says ""Do not include these dependencies at the beginning of your code"" while functions use np/integrate. Failure cause: ""Error: InterpreterError: Reached the max number of operations of 10000000"" at ""result = BoundStates(x_test, Emax=10, Estep=0.1)"". Incorrect result after optimization: ""Found 1 bound states:   n=6: E=0.3152"" (expected ~1,3,5,7).",scicode_scicode_tool_calling_agent_claudeopus41_1755801688_UPLOAD
62,scicode,1.00,0,"existence_reasoning: The benchmark-provided H_XXZ reference implementation multiplies SciPy sparse matrices using the Python '@' operator (MatMult). In the given execution environment, sparse MatMult is not implemented, producing a NotImplementedError. This is an intrinsic incompatibility between the benchmark's specified scaffold and the runtime, because any agent that follows the provided H_XXZ code (or relies on it indirectly through block_enlarged/dmrg_module) will hit the same runtime failure unless they reimplement around it. The benchmark thus contains an environment/API mismatch: the supplied canonical function uses an operation unsupported by the harness' SciPy/sparse configuration. | causation_reasoning: The agent's failures during block_enlarged and dmrg_module testing were triggered by this exact intrinsic incompatibility: calls that ultimately relied on H_XXZ's '@' sparse multiplication errored with ""NotImplementedError: Binary operation MatMult is not implemented."" Although the agent attempted workarounds (manual .dot-based multiplication), the run is marked failed and the trace shows repeated hard failures at the points where the benchmark's sparse MatMult behavior mattered. Therefore the deficiency both exists and was a proximate cause of the observed failure events. | evidence: 1) Initial failure when testing block_initial: ""InterpreterError: Forbidden function evaluation: 'Block' is not among the explicitly allowed tools"" (tooling mismatch during testing).
2) Core recurrent failure tied to sparse MatMult: ""Code execution failed ... due to: NotImplementedError: Binary operation MatMult is not implemented."" occurs multiple times, e.g. at T0B47 and T0B52.
3) Benchmark-provided H_XXZ uses '@' on sparse matrices: ""XX_YY_term = (J/2.0) * (Sp1_full @ Sm2_full + Sm1_full @ Sp2_full)"" and ""ZZ_term = ... (Sz1_full @ Sz2_full)"".
4) Agent explicitly identifies this mismatch: ""The H_XXZ function uses the `@` operator which may not be properly implemented for sparse matrices in some versions.""",scicode_scicode_tool_calling_agent_claudeopus41_1755801688_UPLOAD
60,scicode,1.00,0,"existence_reasoning: The benchmark environment/tooling is internally inconsistent about how the agent should produce the final answer. Earlier tasks instruct: ""Write the complete and executable Python program... Ensure your response is in the format of ```python```"" and the agent appropriately uses `final_answer(...)`. However, the harness later appears to parse the agent's `final_answer` payload as Python code (not as a tool call result), causing syntax errors when the payload contains markdown fences or triple-quoted strings. This indicates a structural mismatch between expected output channel/format and what the parsing/evaluation apparatus actually accepts, independent of agent capability. | causation_reasoning: The agent's implementation of `init_system` was correct and passed unit tests, but the run failed due to the evaluation/parser choking on how the answer was emitted (markdown fences/triple quotes inside `final_answer`). The failure is therefore attributable to the benchmark's output-handling/parsing setup rather than the algorithmic solution. Once the agent stopped using `final_answer` and instead printed plain code, the function content itself was fine, supporting that the proximate failure was formatting/parsing incompatibility. | evidence: 1) Parser failure when the agent tried to submit via `final_answer` with a markdown-wrapped string: ""Call id: call_7\nError: Code parsing failed on line 1 due to: SyntaxError\nfinal_answer(\""\""\""```python              ^\nError: unterminated triple-quoted string literal"".
2) Earlier parser failure from embedding non-Python bullets in a triple-quoted payload: ""Code parsing failed on line 10 due to: SyntaxError\n        - positions(np.ndarray): ... ^\nError: invalid decimal literal"".
3) Despite these submission failures, the underlying function worked in interpreter tests: e.g., for `init_system` tests: ""All particles within [0, L]: True"" and ""All positions are unique: True"".",scicode_scicode_tool_calling_agent_claudeopus41_1755801688_UPLOAD
61,scicode,1.00,0,"existence_reasoning: The benchmark environment’s python_interpreter cannot execute the matrix multiplication operator '@' (NumPy matmul), raising a NotImplementedError. Since the task series explicitly depends on NumPy linear algebra (B matrices, U matrices, rotations) and typical solutions will use '@', this is an intrinsic environment/evaluation deficiency that can block correct implementations/tests. Additionally, the benchmark mixes reciprocal-lattice conventions: the prompt specifies a_i·b_j=δ_ij (no 2π), while the momentum-transfer definition and typical diffraction k-vectors are often tied to 2π/λ. This convention mismatch is not clearly resolved, making the intended scaling ambiguous and leading to disagreements in downstream steps (e.g., get_hkl scaling). | causation_reasoning: The agent’s first u_triple test run failed immediately due to the interpreter not supporting '@' (MatMult), preventing execution of an otherwise standard NumPy implementation. This is a hard blocker independent of agent capability, and directly caused the observed failure at that point in the trace. Later, the agent’s get_hkl tests show systematic scaling mismatch and the agent explicitly struggles to resolve 2π factors, reflecting the benchmark’s underspecified/contradictory conventions; this also contributes to failure in producing the correct hkl mapping. Even though the agent attempted workarounds (np.dot, manual cross products), the initial failure and the persistent scaling ambiguity both stem from benchmark formation issues rather than purely agent mistakes. | evidence: Hard environment blocker: ""NotImplementedError: Binary operation MatMult is not implemented."" occurred when running `result = u_triple(...)` after using `q1 = B @ H1_vec`.

Convention ambiguity/scale mismatch: prompt states ""we will follow the convention a_i · b_j = δ_ij"" while q_cal uses ""k=1/\lambda""; later test shows mismatch: ""Calculated HKL: (0.379, 0.000, -0.014)"" for expected (1,0,0), and agent notes need for 2π: ""The key insight is that Q = 2π * G... need to account for this 2π factor.""",scicode_scicode_tool_calling_agent_claudeopus41_1755801688_UPLOAD
59,scicode,1.00,0,"existence_reasoning: The benchmark/tooling environment used for execution does not support Python's matrix multiplication operator '@' (MatMult). This is an environmental/parser limitation inconsistent with standard NumPy usage. The task instructions and provided dependencies imply normal Python/NumPy linear algebra should work, and the agent reasonably used '@' in intermediate steps and even in the final measureZ/projection code at times. Because the environment rejects '@', any agent using conventional NumPy matmul syntax will hit NotImplementedError, making the benchmark implicitly assume a capability (MatMult) that is not present. | causation_reasoning: The run is marked failed and the critical errors encountered were directly due to the environment raising NotImplementedError for MatMult during tests/optimization (e.g., unitarity checks and later VQE optimization). These errors interrupted the agent's ability to validate and proceed normally. While the agent sometimes adapted by switching to np.dot, the environment-induced MatMult failures recurred (e.g., inside optimize calls), derailing the run. Thus the intrinsic environment deficiency (no MatMult) was a proximate cause of failure. | evidence: Multiple executions fail with: ""NotImplementedError: Binary operation MatMult is not implemented."" Examples:
- During unitarity check: ""Code execution failed at line 'print(""R† R ="", np.allclose(np.conj(Rx_pi2.T) @ Rx_pi2, np.eye(2)))' due to: NotImplementedError: Binary operation MatMult is not implemented.""
- During ansatz attempt: ""Code execution failed at line 'test_result = create_ansatz(0.5)' due to: NotImplementedError: Binary operation MatMult is not implemented.""
- During VQE: ""Code execution failed at line 'optimized_energy = perform_vqe(gl_test)' due to: NotImplementedError: Binary operation MatMult is not implemented.""
Additionally, later generated code reintroduces '@' (e.g., final measureZ variant starts with ""psi_transformed = U @ psi""), showing the benchmark environment's rejection of '@' is a systemic barrier.",scicode_scicode_tool_calling_agent_claudeopus41_1755801688_UPLOAD
58,scicode,1.00,0,"existence_reasoning: The benchmark instructions for the TOV step are internally inconsistent and misaligned with the stated response constraints. The prompt explicitly says to use functions `press_from_rho`, `rho_from_press`, and `eps_from_press`, but the provided implementations are named `eos_press_from_rho`, `eos_rho_from_press`, and `eos_eps_from_press`, creating an interface mismatch. Additionally, the TOV step requires matching gravitational potential to the exterior solution and returning a central time dilation, but the benchmark never clearly defines whether `phi` corresponds to ν, ν/2, or ln(lapse), leaving an underspecified convention that affects the required matching. Finally, the response constraints for code steps disallow nested functions and adding dependencies at the beginning, but the agent is effectively forced to either (a) call an existing `tov_RHS` (not available inside the function unless assumed global) or (b) define a nested RHS for `odeint`. This creates a structural double-bind where a correct implementation may be rejected by the grader/template rules. | causation_reasoning: The agent's final submission fails primarily due to these benchmark formation issues rather than reasoning about TOV physics. The agent's final `tov` includes a nested `rhs` function and imports inside the function, which violate the benchmark’s earlier stated response guidelines (no nested functions; dependencies are predetermined). This is a direct consequence of the scaffold not providing a callable `tov_RHS` in-scope and the prompt requiring SciPy integration. Also, the mismatch between required function names (`press_from_rho` vs `eos_press_from_rho`) and the ambiguous meaning of `phi` make it likely that even a physically correct solution would fail hidden tests expecting different names/conventions. The run is marked failed after these inconsistencies and earlier tool-parsing issues; correcting the benchmark to provide consistent function names and explicit `phi` convention (and/or allow nested RHS or provide `tov_RHS` in scope) would likely allow success. | evidence: Name mismatch requirement: ""Use the functions `eps_from_press` and `rho_from_press`"" while provided functions are `eos_eps_from_press` / `eos_rho_from_press`.
Later step: ""Use the functions `press_from_rho`"" but only `eos_press_from_rho` exists.
Underspecified phi: prompt asks to ""match[] the gravitational potential to the outer potential"" and output ""gravitational time dilation"" but does not define phi convention; agent assumes phi_surface = 0.5*log(1-2M/R).
Structural double-bind: agent final code defines nested RHS: `def rhs(y, r, eos_Gamma, eos_kappa): ...` inside `tov`, contradicting earlier guidance ""Do not attempt to write nested functions"".
Dependency placement conflict: agent includes `import numpy as np` / `import scipy.integrate as si` inside function in final answer.
Failure marker: run metadata shows ""failed"": true.",scicode_scicode_tool_calling_agent_claudeopus41_1755801688_UPLOAD
66,scicode,1.00,0,"existence_reasoning: The benchmark environment/tooling is internally inconsistent with the task’s required dependencies and output protocol. The task explicitly allows/depends on numpy (and numpy.linalg) for implementations (graphene geometry, normals, KC potential) and even requires returning numpy arrays. However, the provided python execution tool disallows importing numpy entirely (authorized imports exclude numpy). Additionally, the run shows a separate harness/tool that tries to parse code passed to final_answer as Python; the benchmark instructions ask the agent to output code inside markdown fences, but feeding fenced code into that harness triggers SyntaxError. These are structural issues that can impede any agent: (1) inability to execute required dependency-based tests in the supplied interpreter, and (2) misalignment between expected response formatting and the evaluation/parsing mechanism. | causation_reasoning: The agent’s failure is directly triggered by these intrinsic issues. When attempting to run a unit test for the KC repulsive potential, execution fails because numpy cannot be imported in the python_interpreter, preventing completion of the prescribed “test using the python interpreter” step. Later, when attempting to submit results via final_answer, the environment parses the string as Python and raises SyntaxError due to triple-quoted strings containing markdown fences, causing repeated submission failures. The final state is marked failed, and the trace shows these errors occurring at the key submission/testing points rather than from incorrect algorithmic reasoning. | evidence: 1) Dependency/tool mismatch: ""Import of numpy is not allowed. Authorized imports are: ['random', 'datetime', ...]"" when running the unit test for potential_repulsive.
2) Formatting/parsing mismatch causing submission failure: ""Error: unterminated triple-quoted string literal"" at attempts like ""final_answer(\""\""\""```python"" and similarly for taper/calc_potential.
3) Benchmark requires numpy: ""DEPENDENCIES: Use only ... import numpy as np import numpy.linalg as la"" and functions are specified to return np.array.
4) Final run marked failed in metadata: ""\""failed\"": true"".",scicode_scicode_tool_calling_agent_claudeopus41_1755801688_UPLOAD
63,scicode,1.00,0,"existence_reasoning: The benchmark scaffolding introduces structural inconsistencies that can break correct solutions. First, the evaluation harness includes a system step that rewrites submitted code to “ONLY consist of one python function” and removes imports; however, the required functions rely on external modules (np/scipy) and the prompt itself says “Do not include these dependencies at the beginning of your code.” That combination is contradictory: if imports are removed and cannot be included at top-level, functions referencing `np` will NameError unless every function re-imports internally. Second, the task’s stated array shapes are inconsistent with the code produced/expected: `initialize_grid` returns column vectors (N_p,1)/(N_t,1), but `apply_boundary_conditions` documentation claims (1*N_p) and then the provided baseline implementation treats `p[i]` as scalar-like; this mismatch propagates and makes downstream indexing/interpolation underspecified. These are intrinsic formation/benchmark issues independent of agent capability. | causation_reasoning: The run is marked failed due to the benchmark’s code-parsing/scaffolding behavior, not because the agent couldn’t implement the requested logic. Specifically, when the agent attempted to call `final_answer` with a markdown-wrapped string, the harness attempted to parse it as code and threw a SyntaxError for an unterminated triple-quoted string. This is a harness/template interaction: the environment is parsing tool calls as Python snippets, and the rubric instructions about output formatting vs tool usage are inconsistent/misleading. Additionally, earlier a system step forcibly stripped imports, demonstrating the harness can invalidate otherwise-correct code by removing required dependencies; this is a benchmark-side constraint that can cause failures regardless of correctness. Thus the proximate failure is caused by intrinsic scaffolding misalignment. | evidence: 1) Harness rewrites code to a single function and removes imports: ""You are a tool... returns only a python function... Please remove any dependencies or imports"" (system message at <|T0B16|>). This conflicts with prompt requirement to use numpy/scipy.
2) Final submission failed due to harness parsing `final_answer` content as code: ""Code parsing failed on line 1 due to: SyntaxError ... Error: unterminated triple-quoted string literal ... final_answer(\""\""\""```python"" (at <|T0B84|>).
3) Shape/spec mismatch in task: `initialize_grid` returns `p = p.reshape(-1, 1)` but `apply_boundary_conditions` spec says `p` shape = ""1 * N_p"" and baseline implementation uses `p[i]` directly (shown in task statement around <|T0B53|>), indicating inconsistent expected input structure.",scicode_scicode_tool_calling_agent_claudeopus41_1755801688_UPLOAD
67,scicode,0.00,0,"existence_reasoning: The benchmark environment/tooling is internally inconsistent: the agent is told to use `web_search`/`wikipedia_search`, but the execution harness only exposes `python_interpreter` and explicitly restricts imports. In the trace, the agent repeatedly calls `web_search` from inside `python_interpreter`, which cannot work as a Python function unless the harness injects it into that interpreter scope. Also, `web_search` repeatedly times out, meaning the task implicitly depends on external network availability that is unreliable. These are intrinsic deficiencies in the evaluation apparatus (tool availability and network dependence), not in the scientific problem itself. | causation_reasoning: Despite the tooling issues, the agent did eventually implement all required functions, including the final one (`D_b_qz_mat`). The recorded failure appears to be due to the agent producing an incorrect numerical/matrix implementation and later deviating from the intended numpy-based solution (manual lists, custom inversion), not because the benchmark was impossible. The final output shown for `D_b_qz_mat` is a pure-Python matrix implementation rather than a correct numpy-based bulk formulation, and earlier the agent’s matrix approach disagreed strongly with the analytic result (a correctness/physics/implementation issue). Therefore, while a tooling deficiency exists, it was not the proximate cause of failure. | evidence: Tooling/network deficiency evidence: 
- ""⚠️ Web search failed ... operation timed out). Falling back to Wikipedia."" appears multiple times.
- Calls show `python_interpreter` invoked with code containing `web_search(...)`: e.g., ""Calling tools: ... 'name': 'python_interpreter', 'arguments': '... result = web_search(...)'"".
Agent failure not caused by this: 
- The agent’s first numerical bulk attempt diverged from analytic: ""Relative difference: Real part: 2403.06% ... ⚠ Results differ significantly"".
- Final `D_b_qz_mat` output uses manual list matrices and custom inversion rather than correct numpy approach, indicating implementation/correctness issues rather than an unsatisfiable benchmark.",scicode_scicode_tool_calling_agent_claudeopus41_1755801688_UPLOAD
