task_id,criteria,grade,correct,explanation,model_run
23,scicode,0.00,0,"existence_reasoning: The benchmark task (implement blahut_arimoto with numpy available) is well-formed and solvable in the stated environment. There is no contradiction between required approach and available dependencies: numpy is allowed and sufficient. The function header, I/O description, and stopping criterion are specified adequately. No template/evaluation-harness mismatch is evident; the agent successfully derived a correct numpy implementation and validated it with known channels. | causation_reasoning: The run failed due to the agent's final submission violating the benchmark's dependency rules (and likely the grader expectations) by removing numpy usage and introducing an in-function import of math. This is an agent-side compliance/implementation error, not caused by any intrinsic benchmark deficiency. The agent had a correct numpy version earlier, indicating the task was achievable; the failure arose from producing an altered final function that doesn't match the intended environment/constraints. | evidence: Agent produced a correct numpy-based implementation and tests: ""Calculated capacity: 0.5310"" matching expected, and later ""Calculated capacity: 0.7000"" and ""Calculated capacity: 1.5850"".
Final submitted function removed numpy and added imports: ""# Convert to numpy-like operations without import"" and inside loop ""import math"".
Benchmark constraint: ""DEPENDENCIES: Use only ... import numpy as np"" and earlier guidance for mutual_info also emphasized numpy-only.",scicode_scicode_tool_calling_agent_claudeopus41_1755801688_UPLOAD
75,scicode,1.00,0,"existence_reasoning: The benchmark/tooling environment used for testing does not support Python's matrix multiplication operator (@) / MatMult AST node, even though the task expects normal NumPy-based linear algebra operations and the agent is instructed to test with the provided python interpreter. This is an environment/parser limitation inconsistent with the implied standard Python+NumPy environment for scientific code. This constitutes an intrinsic deficiency because any agent that uses idiomatic NumPy matmul (or code paths inside NumPy that trigger MatMult in this sandbox) will systematically fail during the required testing step. | causation_reasoning: The agent's failure is directly triggered by the environment's inability to execute matrix multiplication during testing, producing a NotImplementedError. This prevents completion/verification of the required function behavior. The agent encountered this multiple times when attempting to compute k-space conversions (and earlier in mk testing) and could not proceed with correct execution in the sandbox. Thus, the task run failed because of the environment deficiency, not primarily due to algorithmic reasoning. | evidence: Tool execution errors during testing: ""Code execution failed ... due to: NotImplementedError: Binary operation MatMult is not implemented."" (at line 'result = mk(latvecs, basis, di, dj, ai, aj)' and later at line 'eigvals_gamma = ham_eig(k_gamma, latvecs, basis)'). Also earlier code uses matmul explicitly: ""R_i = latvecs.T @ di.T + basis[ai].T"" and later k conversion: ""k_cart = recip_latvecs[:2, :2] @ k_input"".",scicode_scicode_tool_calling_agent_claudeopus41_1755801688_UPLOAD
35,scicode,1.00,0,"existence_reasoning: The benchmark’s tool interface is internally inconsistent: the agent is instructed to call helper tools like `web_search()` and `final_answer()`, but the environment routes tool calls through `python_interpreter`, where those symbols are not defined. This makes any agent following the provided “tools behave like regular python functions” instruction likely to hit NameError/parse failures when trying to use tools as specified. Additionally, the rubric/formatting expectations conflict across layers: the agent is told to output code in ```python``` blocks, but later a system message requires returning only a single python function and removing imports/markdown. This scaffolding misalignment makes it easy for a correct solution to be rejected due to formatting/tool invocation rather than algorithmic correctness. | causation_reasoning: The run is marked failed due to repeated code-parsing errors triggered by attempting to use `final_answer(...)` with triple-quoted strings and markdown fences. Those mistakes were prompted by benchmark instructions to wrap the final response in ```python``` and to use `final_answer(answer)` as a tool, but the execution harness treated the content as code and raised SyntaxError. The agent did successfully implement and test `absorption`, but the submission failed at the interface layer (how to return the answer), not due to inability to solve the underlying programming/physics task. If the benchmark provided a consistent submission channel (either plain code response OR a callable final_answer tool that is actually available), the agent’s correct function would likely have been accepted. | evidence: Tool/scaffold inconsistency: the agent tries to use tools inside `python_interpreter`: `Calling tools: [{'name': 'python_interpreter', 'arguments': 'result = web_search(...)'}]` with observation `Web search failed ... Falling back to Wikipedia.` indicating tool use is not standard python.
Primary failure cause: `Error: Code parsing failed ... SyntaxError final_answer(""""""```python ^ Error: unterminated triple-quoted string literal` (appears twice: around T0B37 and T0B51/T0B53). This shows failure arose from the required answer-packaging/tool invocation rather than the core function logic.
Conflicting output requirements: earlier response guidelines demand code in ```python```, while later system instruction says: `Your response should ONLY consist of one python function. ... remove any dependencies or imports ... response should be in the format of ```python ```.`",scicode_scicode_tool_calling_agent_claudeopus41_1755801688_UPLOAD
41,scicode,1.00,0,"existence_reasoning: The benchmark asks for “the fraction of area that this region takes within the whole resource supply simplex” and says “for N=R there's a simple way … by calculate the determinant of M,” but it never specifies the precise geometric mapping between det(M) (a volume scaling in R-dimensional linear space) and the (R-1)-dimensional simplex measure on the hyperplane sum_i R_i=1. Without stating which vertices define the coexistence simplex/polytope, whether to use columns of M or res_pts from GetResPts, and the exact normalization constant, multiple incompatible formulas are plausible (e.g., |det(M)|, |det(M)|/(R-1)!, |det(M)|/(sqrt(R)(R-1)!), etc.). This is genuine underspecification: a correct agent cannot know what the grader expects. | causation_reasoning: The agent’s failure stems from this underspecification: they produced an initially unnormalized determinant (yielding >1), noticed the contradiction with “fraction,” then guessed a normalization (1/(sqrt(R)*(R-1)!)). Because the task never defines the correct normalization or the intended geometry, any chosen formula risks mismatch with the hidden expected answer. Thus the benchmark’s missing specification is the proximate cause of failure rather than an implementation mistake. | evidence: Task statement: “For N=R there's a simple way to get the area of the region formed by those points by calculate the determinant of M. Write a function to calculate the fraction of area that this region takes within the whole resource supply simplex (defined by \sum_i R_i=1).”
Agent test revealed ambiguity/need for normalization: “Structural stability for N=R=2: 2.9524924420125593 … Expected range for S should be between 0 and 1” followed by “I see an issue… I need to understand how the determinant relates to the area of the region in the simplex.”
Agent then guessed a formula: “the volume is 1/√R × 1/(R-1)! … S = abs(det_M) * simplex_volume,” demonstrating the task did not specify which normalization is correct.",scicode_scicode_tool_calling_agent_claudeopus41_1755801688_UPLOAD
32,scicode,1.00,0,"existence_reasoning: The benchmark instructs the agent to implement solutions using numpy/scipy and to test them using the provided python_interpreter. However, the python_interpreter environment explicitly disallows importing numpy/scipy (only a small whitelist is allowed). This creates a structural contradiction: the required dependencies cannot be executed in the mandated testing tool, impeding any agent from following the stated approach guidelines (implement + test) with the specified dependencies. | causation_reasoning: The run failed because the agent attempted to test code that imports numpy as required by the benchmark dependencies, and the interpreter raised an error that numpy imports are not permitted. This directly prevented the agent from executing and validating the solution within the provided tool, causing the failure in the run transcript. Although the agent later produced code text, the run is marked failed due to the earlier unrecoverable tool constraint during testing. | evidence: Tool spec: python_interpreter ""can only import ... ['queue', ... 'datetime']"" (no numpy/scipy).
Benchmark dependencies require: ""import numpy as np\nimport scipy\nfrom scipy.constants import epsilon_0, c"".
Failure: ""InterpreterError: Import of numpy is not allowed. Authorized imports are: ['queue', ... 'datetime']"" when running code containing ""import numpy as np"".
Run metadata: ""failed"": true.",scicode_scicode_tool_calling_agent_claudeopus41_1755801688_UPLOAD
31,scicode,1.00,0,"existence_reasoning: The benchmark instructs implementing whitening/ICA using standard NumPy matrix multiplication semantics (either @ or dot). However, the provided execution environment/tooling cannot execute matrix multiplication in the normal way: during testing, the interpreter raises `NotImplementedError: Binary operation MatMult is not implemented.` This indicates an intrinsic mismatch between the benchmark's assumed Python/NumPy execution model and the actual evaluator's supported operations. Since whitening/ICA fundamentally requires matrix multiplications, an environment that cannot support MatMult (and appears to inconsistently handle linear algebra) constitutes a formation deficiency that can impede agents even when implementing the correct algorithm. | causation_reasoning: The agent's first whitening implementation used `@` and failed at runtime due to the environment error, not due to algorithmic logic. The failure that marks the run as failed is triggered directly by the evaluator/tooling inability to handle MatMult. Although the agent later rewrote whitening using `np.dot` and proceeded, the recorded run status is failed and the proximate cause shown in-trace is the MatMult not being implemented. Thus the intrinsic environment deficiency caused the observed failure. | evidence: Runtime failure during unit test: `Code execution failed at line 'Z = whiten(X)' due to: NotImplementedError: Binary operation MatMult is not implemented.` Earlier whitening version used MatMult: `C = (1/n) * D @ D.T` and `Z = W @ D`.",scicode_scicode_tool_calling_agent_claudeopus41_1755801688_UPLOAD
76,scicode,1.00,0,"existence_reasoning: The benchmark specifies allowed dependencies for solutions as `import numpy as np`, `import random`, `from collections import Counter`. However, the execution environment/tooling shown in the trace for `python_interpreter` explicitly restricts imports to a small whitelist that does NOT include `numpy`. This creates an intrinsic contradiction: the task requires/permits numpy, while the provided execution harness used for iterative testing cannot import numpy. Additionally, a later system message requires stripping imports and returning only a single function, which—if followed—would leave references like `np` undefined unless the grader pre-imports numpy, an assumption not stated in the task itself. These are formation/environment mismatches that can prevent correct solutions from running regardless of agent capability. | causation_reasoning: The run is marked failed, and the final delivered `scan_sequence` function avoids using the allowed/expected dependencies (`np`, `Counter`) and instead uses nested `import math` inside loops and manual list processing, which is consistent with compensating for the inability to rely on numpy being available/recognized. The trace earlier shows tool calls incorrectly routing `web_search` through `python_interpreter`, indicating tool/harness instability. Given the explicit environment restriction on imports, any solution that properly uses numpy (as required by the dependency spec and earlier provided code uses `np.array`) would fail in the interpreter/harness. Thus, the benchmark/tooling deficiency plausibly forced the agent into nonconforming code and likely caused the evaluation failure. | evidence: 1) Tool restriction: `python_interpreter` docstring: ""This code can only import the following python libraries: ['datetime', 'unicodedata', 'collections', 'time', 'math', 'itertools', 'queue', 'statistics', 'stat', 're', 'random']"" (numpy absent) while the task says dependencies include `import numpy as np`.
2) Earlier provided/expected code uses numpy: `mat = np.array(values).T` in `load_motif_from_df` and tasks repeatedly specify numpy.
3) Tooling misroute: assistant calls `web_search(...)` but the log shows `Calling tools: ... 'name': 'python_interpreter' ... arguments: 'search_result = web_search(...)'`, indicating harness/tool misconfiguration.
4) Final `scan_sequence` returned code avoids `np` and `Counter`, using `import math` inside loops and manual counting, suggesting adaptation to dependency/tool constraints.",scicode_scicode_tool_calling_agent_claudeopus41_1755801688_UPLOAD
22,scicode,1.00,0,"existence_reasoning: The benchmark instructs the agent to ""test that function using the python interpreter"" and allows dependencies ""import numpy as np"" and ""import scipy"". However, the provided python_interpreter tool explicitly disallows importing numpy/scipy (only a small whitelist is permitted). This is an intrinsic contradiction between the task's required environment (numpy/scipy for spherical Bessel/Wigner/factorial operations) and the evaluation tool available for testing, which would impede any agent attempting to follow the mandated develop-and-test workflow. | causation_reasoning: The agent's failure is directly triggered when attempting to run code with numpy/scipy in the python_interpreter as required by the approach guidelines. The interpreter throws an ImportError due to its restricted import whitelist. This is not an agent logic bug but an environment mismatch; with a python interpreter that actually supports numpy/scipy (as the task claims), the agent could have executed the tests. Thus the intrinsic deficiency caused the run to be marked failed. | evidence: Tool description: ""This code can only import the following python libraries: ['statistics', 'queue', 'math', ...]"" (no numpy/scipy).
Task requirement: ""DEPENDENCIES: ... import numpy as np; import scipy"" and ""Then test that function using the python interpreter"".
Observed failure: ""InterpreterError: Import of numpy is not allowed. Authorized imports are: ['statistics', 'queue', 'math', ...]"" when executing code containing ""import numpy as np"".",scicode_scicode_tool_calling_agent_claudeopus41_1755801688_UPLOAD
30,scicode,1.00,0,"existence_reasoning: The benchmark/evaluation harness appears to post-process the agent's submission with a tool instruction that forces the output to be ONLY one python function (not a class) and strips imports. This is structurally incompatible with the task requirement to submit a full class implementation (e.g., Jastrow or MultiplyWF). Because the post-processor will always reduce any class solution to a single function, a correct class-based solution cannot be preserved/recognized, creating an intrinsic mismatch between task spec and evaluation apparatus. | causation_reasoning: The agent produced correct class implementations (Slater, Jastrow, MultiplyWF). However, the system then applied the 'return only one python function' constraint, and the final emitted answer was only a single method (e.g., kinetic or laplacian) rather than the required class, leading to failure. This failure is directly caused by the benchmark's post-processing/evaluation constraint, not the agent's reasoning or implementation. | evidence: System instruction forcing single function output: ""Your response should ONLY consist of one python function. Please remove any dependencies or imports from the code and any code that is not part of a function or class."" After that, the assistant outputs only a function: ""```python\ndef kinetic(self, configs):\n    lap = self.laplacian(configs)\n    kin = -0.5 * np.sum(lap, axis=1)\n    return kin\n```"" despite the task requiring a class (e.g., ""class Jastrow:"" / ""class MultiplyWF:"").",scicode_scicode_tool_calling_agent_claudeopus41_1755801688_UPLOAD
56,scicode,0.00,1,"existence_reasoning: The benchmark tasks shown (implementing allowed_orders, G_mat, check_G_feasibility, get_dep_orders) are well-formed with consistent function headers, clear I/O requirements, and an achievable implementation using the allowed dependencies. No template/harness mismatch is evident: the final expected outputs are plain function definitions. The environment expectations (numpy available, math functions, etc.) match the dependency list. | causation_reasoning: There was no ultimate task failure (run metadata shows ""failed"": false). The only observed errors were transient SyntaxErrors caused by the agent embedding markdown fences and triple-quoted strings inside a tool call (e.g., final_answer(""""""```python ..."""""")), which is an agent formatting mistake rather than a benchmark deficiency. After correcting formatting, the agent produced valid function code. | evidence: Run metadata: ""failed"": false.
Transient agent-caused error: ""Code parsing failed... SyntaxError final_answer(\""\""\""```python ^ Error: unterminated triple-quoted string literal"" (at T0B28 and again at T0B56).
Final correct output functions are shown afterward, e.g. check_G_feasibility at T0B46 and get_dep_orders at T0B59.",scicode_scicode_tool_calling_agent_claudeopus41_1755801688_UPLOAD
33,scicode,0.00,0,"existence_reasoning: The task is well-formed: it provides a clear function header (compute_chern_number_grid), required inputs/outputs, parameter sweep ranges, and allowed dependencies. There is no inherent contradiction between instructions and environment, no broken template/interface, and no missing required information that would prevent a capable agent from producing the expected function. | causation_reasoning: The run failed due to an agent-generated formatting/syntax mistake when calling final_answer with an unterminated triple-quoted string that included embedded markdown backticks. This is not caused by the benchmark but by the agent's construction of the response. The agent later produced a clean function, indicating the task itself was solvable. | evidence: Failure is explicitly a syntax error from the agent's final_answer call: ""Code parsing failed on line 48 due to: SyntaxError\nfinal_answer(\""\""\""```python              ^\nError: unterminated triple-quoted string literal"". The benchmark did not force this; it came from the agent embedding ```python inside a triple-quoted string.",scicode_scicode_tool_calling_agent_claudeopus41_1755801688_UPLOAD
34,scicode,0.00,0,"existence_reasoning: There are benchmark/tooling inconsistencies: (a) the agent was instructed to call web_search/wikipedia_search, but the trace shows the agent calling python_interpreter with code that calls web_search/wikipedia_search inside it, which should not be possible if tools are only callable at top level; (b) the task says the only allowed dependency is numpy, yet the provided prior-step Fermi implementation imports math, and later the agent used math/log without numpy; (c) the task text for electron charge is malformed (""the electron charge is ×10^-19 C"" missing coefficient). These are intrinsic issues in the benchmark scaffolding/instructions. | causation_reasoning: Despite these deficiencies, the proximate failure occurred because the agent attempted to call final_answer with a string containing nested triple-quoted strings and embedded code fences, producing a SyntaxError from the tool/harness. This is an agent formatting/implementation error, not something that would impede any agent. Additionally, the agent later produced a correct potential() function block, indicating the task itself was solvable in the environment. | evidence: Tooling misalignment: ""Calling tools: ... 'function': {'name': 'python_interpreter', 'arguments': '... result = web_search(query)'}"" (calls to web_search made inside python_interpreter).
Dependency mismatch: prompt says ""Use only... import numpy as np"" while provided Fermi code includes ""import math"".
Malformed constant: ""the electron charge is × 10^{-19} C"".
Actual failure: ""Error: unterminated triple-quoted string literal ... final_answer(\""\""\""```python"" and later another ""unterminated triple-quoted string literal"" when wrapping code in final_answer.",scicode_scicode_tool_calling_agent_claudeopus41_1755801688_UPLOAD
36,scicode,0.00,0,"existence_reasoning: The benchmark specifies dependencies including SciPy (""from scipy.integrate import quad"", ""from scipy.optimize import newton""), but the provided python_interpreter tool (earlier in the transcript) only allows importing a small whitelist (math, statistics, etc.) and does not include SciPy. This is an intrinsic environment/dependency mismatch that could impede agents trying to execute tests via the provided interpreter. Additionally, the agent trace shows the harness attempting to parse 'final_answer(...)' as python code in the interpreter, indicating some evaluation/tooling confusion. | causation_reasoning: Despite the environment mismatch, the run's recorded failure is a SyntaxError caused by the agent wrapping the final response in an unterminated triple-quoted string while trying to call final_answer, i.e., an agent formatting/tool-use error. The later final code also contains an additional agent-introduced bug (uses log(...) without qualifying as np.log). Thus the proximate cause of failure is not the benchmark deficiency but the agent's own response formatting and code issues. | evidence: Dependency mismatch: task lists ""from scipy.integrate import quad"" and ""from scipy.optimize import newton"" while earlier tool spec says python_interpreter ""can only import ... ['math', ... 're']"" (no scipy).
Failure shown: ""Code parsing failed ... SyntaxError ... unterminated triple-quoted string literal"" at ""final_code = '''```python"" and again at ""final_answer(\""\""\""```python"" and at ""answer = \""\""\""```python"".
Agent bug in final code: ""Ef_initial = kT * log(n / Nc)"" (log undefined) in the last assistant message.",scicode_scicode_tool_calling_agent_claudeopus41_1755801688_UPLOAD
40,scicode,1.00,0,"existence_reasoning: The benchmark instructs the agent to implement and test code using NumPy (explicit dependency: `import numpy as np`), but the provided `python_interpreter` tool environment explicitly disallows importing NumPy. This is an intrinsic mismatch between the required dependency and the only execution/test mechanism offered in the rubric steps (""Then test that function using the python interpreter""). Any agent attempting to follow the required workflow will hit an unavoidable import error when trying to test NumPy-based solutions in the provided interpreter. | causation_reasoning: The run is marked failed, and the trace shows repeated hard failures when the agent tried to execute code that imports NumPy inside `python_interpreter`. This prevented the agent from performing the mandated testing/debugging steps for the NumPy-based implementation of `solve` (and earlier attempts). The agent had to resort to non-NumPy testing, undermining compliance with the benchmark's required dependency/testing process. Thus the intrinsic tool/dependency conflict directly caused the failure. | evidence: Interpreter rejects NumPy: ""InterpreterError: Import of numpy is not allowed. Authorized imports are: [...]"" (seen at multiple points, e.g. when testing Strang_splitting: ""Code execution failed at line 'import numpy as np'"" and later when testing solve: same error). Benchmark requirement: ""DEPENDENCIES: ... import numpy as np"" and ""Then test that function using the python interpreter."" Run metadata: ""failed"": true.",scicode_scicode_tool_calling_agent_claudeopus41_1755801688_UPLOAD
